{
  "$id": "inspection-report.schema.json",
  "$schema": "https://json-schema.org/draft/2020-12/schema",
  "title": "Inspection Report",
  "type": "object",
  "additionalProperties": false,
  "required": ["id", "repository", "generatedAt", "summary", "findings", "qaResults", "knowledgeCards", "validation"],
  "properties": {
    "id": { "type": "string", "minLength": 1 },
    "repository": {
      "type": "object",
      "additionalProperties": false,
      "required": ["name", "root"],
      "properties": {
        "name": { "type": "string", "minLength": 1 },
        "root": { "type": "string", "minLength": 1 },
        "commit": { "type": "string", "minLength": 1 }
      }
    },
    "generatedAt": { "type": "string", "format": "date-time" },
    "summary": { "type": "string", "minLength": 1 },
    "findings": {
      "type": "array",
      "items": { "$ref": "finding.schema.json" }
    },
    "qaResults": {
      "type": "array",
      "items": { "$ref": "qa-result.schema.json" }
    },
    "knowledgeCards": {
      "type": "array",
      "items": { "$ref": "knowledge-card.schema.json" }
    },
    "validation": {
      "type": "object",
      "additionalProperties": false,
      "required": ["schemaVersion", "commands"],
      "properties": {
        "schemaVersion": { "type": "string", "minLength": 1 },
        "commands": {
          "type": "array",
          "items": {
            "type": "object",
            "additionalProperties": false,
            "required": ["command", "status"],
            "properties": {
              "command": { "type": "string", "minLength": 1 },
              "status": { "enum": ["passed", "failed", "not-run"] },
              "notes": { "type": "string" }
            }
          }
        }
      }
    }
  }
}
